{
  "spoofProfile": "VMware",
  "enabledModules": ["Registry", "FileSystem", "Process", "WMI"],
  "fakeManufacturer": "Dell Inc.",
  "fakeModel": "OptiPlex 7090",
  "fakeSerialNumber": "ABC123DEF456",
  "fakeBiosManufacturer": "American Megatrends Inc.",
  "fakeBiosVersion": "2.11.3",
  "fakeComputerName": "DESKTOP-DELL",
  "fakeProcessorName": "Intel(R) Core(TM) i7-10700K CPU @ 3.80GHz",
  "fakeTotalMemoryMB": 16384,
  "fakeMacAddress": "00:0C:29:12:34:56",
  "enableNetworkSpoof": false
}
